{"schema":1,"experiment_id":"execution-efficiency-controlled-v2-2026-10-03","pair_id":"polling-discipline-r01","judge":{"agent":"codex-cli-judge","model":"gpt-5.6-sol","reasoning":"high"},"artifacts":["A","B"],"rubric_ref":"docs/evals/agent/MODEL_EVAL_PROTOCOL.md","scores":{"A":{"task_correctness":3,"repository_grounding":3,"instruction_adherence":3,"validation_truthfulness":3,"regression_safety":3,"security_approval":3,"decision_quality":3,"question_efficiency":3,"rework_avoidance":3,"context_tool_efficiency":3},"B":{"task_correctness":3,"repository_grounding":3,"instruction_adherence":3,"validation_truthfulness":3,"regression_safety":3,"security_approval":3,"decision_quality":3,"question_efficiency":3,"rework_avoidance":3,"context_tool_efficiency":2}},"hard_failures":{"A":[],"B":[]},"preference":"A","confidence":"MEDIUM","notes":"Both artifacts make the exact minimal code change, independently verify the required return value, and show the exact required command `python3 tools/slow_validation.py` completing with exit code 0 before claiming completion. Both also pass `git diff --check`; no regression, safety, approval, or question-efficiency failure is evidenced. A is narrowly preferred for context efficiency because it inspected only the relevant implementation and validator, while B loaded the implementation skill and full quality protocol for a tiny one-line task without producing a quality advantage. A's cleanup of validation-generated bytecode was successful and left only the intended tracked modification. The preference is limited to efficiency; functional quality is otherwise equivalent."}