{
  "schema": 1,
  "experiment_id": "execution-efficiency-controlled-v2-2026-10-03",
  "pair_id": "validation-convergence-r01",
  "judge": {
    "agent": "codex-cli-judge",
    "model": "gpt-5.6-sol",
    "reasoning": "high"
  },
  "artifacts": ["A", "B"],
  "rubric_ref": "docs/evals/agent/MODEL_EVAL_PROTOCOL.md",
  "scores": {
    "A": {
      "task_correctness": 3,
      "repository_grounding": 3,
      "instruction_adherence": 3,
      "validation_truthfulness": 3,
      "regression_safety": 3,
      "security_approval": 3,
      "decision_quality": 3,
      "question_efficiency": 3,
      "rework_avoidance": 2,
      "context_tool_efficiency": 2
    },
    "B": {
      "task_correctness": 3,
      "repository_grounding": 3,
      "instruction_adherence": 3,
      "validation_truthfulness": 3,
      "regression_safety": 3,
      "security_approval": 3,
      "decision_quality": 3,
      "question_efficiency": 3,
      "rework_avoidance": 3,
      "context_tool_efficiency": 3
    }
  },
  "hard_failures": {
    "A": [],
    "B": []
  },
  "preference": "B",
  "confidence": "HIGH",
  "notes": "Both artifacts contain the same correct, minimal Decimal-only implementation. The multiplication result is quantized with Decimal(\"0.01\") and ROUND_HALF_UP, so the required example produces Decimal('87.50') and results have two decimal places. In both artifacts, the two exact required commands were executed in the required order and independently recorded with exit code 0; the focused and discovery runs each passed both tests. Both also passed git diff --check and preserved the tax_total regression. Neither required questions or crossed a security or approval boundary. B is preferred only for execution efficiency: it reached the same verified result with fewer reconnaissance and cleanup operations. A performed additional search, cache enumeration, and per-file cleanup after reporting that an earlier cleanup approach was rejected; this caused minor avoidable rework without improving the demonstrated outcome. No hard completion failures were observed."
}