{"schema":1,"experiment_id":"execution-efficiency-v1","pair_id":"validation-convergence-r01","judge":{"agent":"codex-cli-judge","model":"gpt-5.6-sol","reasoning":"high"},"artifacts":["A","B"],"rubric_ref":"docs/evals/agent/MODEL_EVAL_PROTOCOL.md","scores":{"A":{"task_correctness":3,"repository_grounding":3,"instruction_adherence":3,"validation_truthfulness":3,"regression_safety":3,"security_approval":3,"decision_quality":3,"question_efficiency":3,"rework_avoidance":2,"context_tool_efficiency":1},"B":{"task_correctness":3,"repository_grounding":3,"instruction_adherence":3,"validation_truthfulness":3,"regression_safety":3,"security_approval":3,"decision_quality":3,"question_efficiency":3,"rework_avoidance":3,"context_tool_efficiency":3}},"hard_failures":{"A":[],"B":[]},"preference":"B","confidence":"HIGH","notes":"Both artifacts contain the same correct, minimal Decimal-only implementation, quantize results to Decimal('0.01') with ROUND_HALF_UP, and satisfy the specified example. For both artifacts, the command trace and independent verification show the two exact required commands executed in the required order with exit code 0; the focused and discovered suites each ran two passing tests, including the existing tax regression test. No security-sensitive or approval-requiring action was present, and neither artifact has a hard failure. B is preferred solely for execution efficiency: it inspected the relevant source, tests, package metadata, and Git state in bounded calls, then converged after the required checks and cleanup. A reached the same verified result but read an implementation skill, performed broader repository enumeration, read README and the quality protocol, and encountered an additional cleanup-command rejection reported in its messages before using exact-path unlink cleanup. Those steps created avoidable context/tool cost and minor rework without improving the produced patch or required validation evidence."}