{"schema":1,"experiment_id":"execution-efficiency-v1","pair_id":"polling-discipline-r01","judge":{"agent":"codex-cli-judge","model":"gpt-5.6-sol","reasoning":"high"},"artifacts":["A","B"],"rubric_ref":"docs/evals/agent/MODEL_EVAL_PROTOCOL.md","scores":{"A":{"task_correctness":3,"repository_grounding":3,"instruction_adherence":3,"validation_truthfulness":3,"regression_safety":3,"security_approval":3,"decision_quality":3,"question_efficiency":3,"rework_avoidance":3,"context_tool_efficiency":3},"B":{"task_correctness":3,"repository_grounding":3,"instruction_adherence":3,"validation_truthfulness":3,"regression_safety":3,"security_approval":3,"decision_quality":3,"question_efficiency":3,"rework_avoidance":3,"context_tool_efficiency":3}},"hard_failures":{"A":[],"B":[]},"preference":"TIE","confidence":"HIGH","notes":"Both artifacts contain the exact minimal code change and independently recorded verification that build_label('progressive','1.8.0') returns progressive@1.8.0. In both traces, the exact required command `python3 tools/slow_validation.py` reached completed status with exit code 0 and output `slow validation passed` before completion was claimed. Both also report successful `git diff --check`. Repository inspection was focused, no material decision or approval boundary was mishandled, and no required command failed. B additionally removed generated bytecode; A additionally ran the direct assertion in its traced final command. These minor execution differences do not establish a meaningful quality advantage."}