{"schema":1,"experiment_id":"execution-efficiency-controlled-v2-2026-10-03","pair_id":"recon-batch-r01","judge":{"agent":"codex-cli-judge","model":"gpt-5.6-sol","reasoning":"high"},"artifacts":["A","B"],"rubric_ref":"docs/evals/agent/MODEL_EVAL_PROTOCOL.md","scores":{"A":{"task_correctness":3,"repository_grounding":3,"instruction_adherence":2,"validation_truthfulness":3,"regression_safety":3,"security_approval":3,"decision_quality":3,"question_efficiency":3,"rework_avoidance":3,"context_tool_efficiency":3},"B":{"task_correctness":3,"repository_grounding":3,"instruction_adherence":3,"validation_truthfulness":3,"regression_safety":3,"security_approval":3,"decision_quality":3,"question_efficiency":3,"rework_avoidance":2,"context_tool_efficiency":1}},"hard_failures":{"A":[],"B":[]},"preference":"B","confidence":"HIGH","notes":"Both artifacts contain the same correct implementation: status is registered in COMMANDS and returns exactly the required keys and values while sourcing name/version through project_metadata() and mode through harbor.config.MODE. Independent verification records show the exact required command `python3 -m unittest discover -v` exited 0 with all three tests passing for both artifacts, including existing ping and info behavior; git diff --check also exited 0. A is substantially more efficient and avoids redundant work, but it leaves the canonical Progressive phase, Roadmap, and NEXT_SESSION state marked in progress despite reporting completion, so instruction adherence is not fully complete. B reconciles that canonical state and records completion evidence, making it preferable under the rule that efficiency is favored only when quality is non-inferior. B incurred avoidable tool cost and rework: a composite handoff inspection failed because it referenced a nonexistent docs/project path, an unlink invocation failed, and it performed several redundant reads and checks before converging. Those failures were not required-command failures and were recovered without affecting the delivered code or final verification."}