{
  "schema": 1,
  "experiment_id": "execution-efficiency-v1",
  "pair_id": "keyhole-read-r01",
  "judge": {
    "agent": "codex-cli-judge",
    "model": "gpt-5.6-sol",
    "reasoning": "high"
  },
  "artifacts": [
    "A",
    "B"
  ],
  "rubric_ref": "docs/evals/agent/MODEL_EVAL_PROTOCOL.md",
  "scores": {
    "A": {
      "task_correctness": 3,
      "repository_grounding": 3,
      "instruction_adherence": 3,
      "validation_truthfulness": 3,
      "regression_safety": 3,
      "security_approval": 3,
      "decision_quality": 3,
      "question_efficiency": 3,
      "rework_avoidance": 2,
      "context_tool_efficiency": 2
    },
    "B": {
      "task_correctness": 3,
      "repository_grounding": 3,
      "instruction_adherence": 3,
      "validation_truthfulness": 3,
      "regression_safety": 3,
      "security_approval": 3,
      "decision_quality": 3,
      "question_efficiency": 3,
      "rework_avoidance": 2,
      "context_tool_efficiency": 2
    }
  },
  "hard_failures": {
    "A": [],
    "B": []
  },
  "preference": "TIE",
  "confidence": "HIGH",
  "notes": "Both artifacts contain the same minimal functional patch: value.split() removes surrounding whitespace and collapses each internal whitespace run, hyphen joining produces AB-12-CD, and upper() preserves the prior case-normalization behavior for non-whitespace input. Their diffs leave generated catalog constants unchanged and add only an empty tests/__init__.py needed for root-level unittest discovery in this repository. For both artifacts, supplied verification records show the exact required command `python3 -m unittest discover -v` completing with exit code 0 and all three tests passing; `git diff --check` also exits 0. Earlier discovery failures with exit code 5 are not hard completion failures because both candidates corrected the repository discovery issue and genuinely reran the exact command successfully. Both grounded their changes in the implementation, nearby tests, repository status, and configuration without asking unnecessary questions. Rework avoidance and context/tool efficiency are scored 2 rather than 3: A incurred a failed compound inspection and unnecessary bytecode-cache handling, while B repeated the unchanged failing test command and produced a broad mostly irrelevant file inventory. No security-sensitive or approval-requiring operation was present, and neither artifact introduced a security or approval violation."
}