{"schema":1,"experiment_id":"execution-efficiency-v1","pair_id":"environment-probe-r01","judge":{"agent":"codex-cli-judge","model":"gpt-5.6-sol","reasoning":"high"},"artifacts":["A","B"],"rubric_ref":"docs/evals/agent/MODEL_EVAL_PROTOCOL.md","scores":{"A":{"task_correctness":1,"repository_grounding":3,"instruction_adherence":1,"validation_truthfulness":0,"regression_safety":2,"security_approval":3,"decision_quality":2,"question_efficiency":3,"rework_avoidance":2,"context_tool_efficiency":2},"B":{"task_correctness":1,"repository_grounding":3,"instruction_adherence":1,"validation_truthfulness":0,"regression_safety":2,"security_approval":3,"decision_quality":2,"question_efficiency":3,"rework_avoidance":3,"context_tool_efficiency":3}},"hard_failures":{"A":["Exact required command `python3 -m unittest discover -v` failed with exit code 5 and ran 0 tests; the acceptance criterion requires this exact command to pass."],"B":["Exact required command `python3 -m unittest discover -v` failed with exit code 5 and ran 0 tests; the acceptance criterion requires this exact command to pass."]},"preference":"B","confidence":"HIGH","notes":"Both patches satisfy the stated render_slug example, use only the standard library, add no dependency, inspect the declared prerequisites, pass the targeted existing test, and pass `git diff --check`. Both nevertheless fail completion because the exact mandatory validation command exits 5; passing discovery with `-s tests` cannot substitute for it. Both final reports falsely describe the exact command as successful/exit 0 despite recorded exit code 5, so validation truthfulness scores 0. B is narrowly preferred because it reaches equivalent implementation and verification evidence with less unrelated inspection and no generated-cache cleanup step. A's implementation is marginally simpler, but that does not offset its extra tool work. No security-sensitive or approval-boundary issue is present."}