{"schema":1,"experiment_id":"execution-efficiency-controlled-v2-2026-10-03","pair_id":"environment-probe-r01","judge":{"agent":"codex-cli-judge","model":"gpt-5.6-sol","reasoning":"high"},"artifacts":["A","B"],"rubric_ref":"docs/evals/agent/MODEL_EVAL_PROTOCOL.md","scores":{"A":{"task_correctness":3,"repository_grounding":3,"instruction_adherence":3,"validation_truthfulness":3,"regression_safety":3,"security_approval":3,"decision_quality":3,"question_efficiency":3,"rework_avoidance":3,"context_tool_efficiency":2},"B":{"task_correctness":3,"repository_grounding":3,"instruction_adherence":2,"validation_truthfulness":3,"regression_safety":3,"security_approval":3,"decision_quality":3,"question_efficiency":3,"rework_avoidance":3,"context_tool_efficiency":1}},"hard_failures":{"A":[],"B":[]},"preference":"A","confidence":"HIGH","notes":"Both patches satisfy the demonstrated local contract, add no dependency, and have independent evidence that the exact required command `python3 -m unittest discover -v` exited 0 with the acceptance test passing. Both also verified Python 3.12.10, Git 2.50.1, and schema-probe 1.2.0. A is preferred because its implementation is slightly simpler and its inspection was substantially more batched. A had one non-required reconnaissance command exit 2 when an `rg` search encountered absent paths; this is not a hard failure because the required unittest passed independently and `git --version` demonstrably succeeded before the chained search ran. B fragmented repository reads and executed the three already-known prerequisite probes as separate calls despite its loaded workflow explicitly requiring one grouped probe, reducing instruction adherence and context/tool efficiency. No security or approval boundary was implicated."}